Numéro,Heure,Destination,,Fiche horaire
RER B Transilien,11h00,Aéroport Charles-de-Gaulle 2,départ imminent,
RER D Transilien,11h00,Melun,départ imminent,Horaires Paris Nord Melun
47417 TER,11h01,Beauvais,départ dans 1 minute,Horaires Paris Nord Beauvais
RER D Transilien,11h02,Goussainville,départ dans 2 minutes,Horaires Paris Nord Goussainville
RER E Transilien,11h02,Haussmann Saint-Lazare,départ dans 2 minutes,Horaires Paris Nord Haussmann Saint-Lazare
25445 Transilien,11h04,Luzarches,départ dans 4 minutes,Horaires Paris Nord Luzarches
RER E Transilien,11h05,Chelles-Gournay,départ dans 5 minutes,Horaires Paris Nord Chelles-Gournay
RER B Transilien,11h05,St-Rémy-les-Chevreuse,départ dans 5 minutes,
RER D Transilien,11h06,Corbeil-Essonnes,départ dans 6 minutes,Horaires Paris Nord Corbeil-Essonnes
RER B Transilien,11h06,Mitry-Claye,départ dans 6 minutes,Horaires Paris Nord Mitry-Claye
9023 Eurostar,11h07,London St. Pancras EST,départ dans 7 minutes,
RER B Transilien,11h08,Massy Palaiseau RER,départ dans 8 minutes,
RER D Transilien,11h08,Orry la Ville-Coye,départ dans 8 minutes,Horaires Paris Nord Orry la Ville-Coye
48507 TER,11h10,St-Just en Chaussée,départ dans 10 minutes,Horaires Paris Nord St-Just en Chaussée
23463 Transilien,11h11,Pontoise,départ dans 11 minutes,Horaires Paris Nord Pontoise
9333 Thalys,11h21,Bruxelles Midi,départ dans 21 minutes,Horaires Paris Nord Bruxelles Midi
7535 TGV,11h42,Rang du Fliers-Verton,départ dans 42 minutes,Horaires Paris Nord Rang du Fliers-Verton
9437 Thalys,11h57,Essen Hbf,départ dans 57 minutes,
49917 TER,11h58,Laon,départ dans 58 minutes,Horaires Paris Nord Laon
12309 Intercités,12h07,St-Quentin,départ dans 1 h 7 min,Horaires Paris Nord St-Quentin
47609 TER,12h10,Creil,départ dans 1 h 10 min,Horaires Paris Nord Creil
9339 Thalys,12h21,Amsterdam CS,départ dans 1 h 21 min,Horaires Paris Nord Amsterdam CS
12011 Intercités,12h28,Amiens,départ dans 1 h 28 min,Horaires Paris Nord Amiens
7043 TGV,12h41,Lille-Flandres,départ dans 1 h 41 min,Horaires Paris Nord Lille-Flandres
7321 TGV,12h46,Dunkerque,départ dans 1 h 46 min,Horaires Paris Nord Dunkerque
47807 TER,12h49,Compiègne,départ dans 1 h 49 min,Horaires Paris Nord Compiègne
2013 Intercités,13h59,Abbeville,départ dans 2 h 59 min,Horaires Paris Nord Abbeville
